{
  "schemaVersion": 2,
  "evidence": "standard-core-validation-evidence-v2",
  "generatedAt": "2026-10-07T16:11:55.8903030Z",
  "runId": "bfdf8e41bd654b5ebb502db42feeb6b9",
  "state": "PASS",
  "exitCode": 0,
  "releaseEligible": false,
  "contentMode": "immutable-source",
  "candidate": {
    "repository": "https://github.com/SyuanTsai/Skill-General.git",
    "sourceRevision": "b55665174fc4ab02d8cd941348fb4e0394042aec",
    "baseRevision": "96dd761fc73e555966be44a52ea10a4959a70c45",
    "contentSha256": "7af7a0fb2fea0c27af3bb4d9b4ccacfeaeba4bafa7c573302695603a0b4f791a",
    "inventory": [
      {
        "path": ".github/workflows/validate.yml",
        "sha256": "abba6b80fe48f40a62d06534e16399f775965d869003bfd35d62b1413bf91097",
        "length": 50522
      },
      {
        "path": "LICENSE",
        "sha256": "1eb85fc97224598dad1852b5d6483bbcf0aa8608790dcc657a5a2a761ae9c8c6",
        "length": 11558
      },
      {
        "path": "NOTICE",
        "sha256": "4eb6ea310aee9a5cf6a237bb93868292f2e133c8a5259fa9166523ed6f25afec",
        "length": 205
      },
      {
        "path": "PROVENANCE.md",
        "sha256": "f20b509354de1da19e2b368309aa51582f4369b01976e51e85dd51d6281e9f8e",
        "length": 2482
      },
      {
        "path": "README.md",
        "sha256": "e9be16e81acf13922dfd4b7af3c255f954aee7f0de7358b6ece6cb813fe67458",
        "length": 11119
      },
      {
        "path": "REUSE.toml",
        "sha256": "55d5924803ff45fc2ebcdd7ce191f3c9356689ea90d5c1b6095d36744da24de9",
        "length": 1232
      },
      {
        "path": "THIRD_PARTY_NOTICES.md",
        "sha256": "81f154260f0e93ad41337e58c0ca2875a1948467a7e9cc16c1265408495399a2",
        "length": 1014
      },
      {
        "path": "catalog/source.json",
        "sha256": "1fc0085e191c4114a62339ea6bf7909329ed03b4db50a1d4aa7f846062d6d63b",
        "length": 402
      },
      {
        "path": "config/pester-6.2.0-closure.lock.json",
        "sha256": "afa28517e21fc394bfdde126d8ac2fa2020d6e38599304c096541a4b217e409b",
        "length": 3652
      },
      {
        "path": "config/standard-v1.json",
        "sha256": "b8c1fda75fdf15bee2b67f0ac0aa8f201048059f3976d640c16366e6cba378be",
        "length": 5536
      },
      {
        "path": "docs/plans/SYP-20.md",
        "sha256": "0a6e19ace2670faf05ee34ecc0996e5c6bb64fedf31d8df6670d7defdcc2f03c",
        "length": 5566
      },
      {
        "path": "scripts/CorePesterIntegrity.psm1",
        "sha256": "82ed51c761c6b42ebdba421791ad5a4bfca6282e4e824bf8d3695c76632465a8",
        "length": 38697
      },
      {
        "path": "scripts/Invoke-CorePester.ps1",
        "sha256": "e6749cace00f8d75f46a4afef542266a3c26705376e729aae99247964d8ddc73",
        "length": 33703
      },
      {
        "path": "scripts/Prepare-PesterRuntime.ps1",
        "sha256": "4361a1d842fd90364405bc8f71c8aef89d6ccf05361fa1c741cd42de837c8d9b",
        "length": 11437
      },
      {
        "path": "scripts/Test-SkillGeneral.ps1",
        "sha256": "bc40e61dc84cecc5e7e952a4ddcf26f5df15764e54e09635cfd5ce2cb90f858c",
        "length": 27500
      },
      {
        "path": "scripts/Validate.ps1",
        "sha256": "130bc1a6bffb6f4e910f3178701f858e8a2870d6e96d0679dbca2a3ee1340426",
        "length": 164537
      },
      {
        "path": "skills/investigate-datadog-logs/SKILL.md",
        "sha256": "12de21156a4da29a8a7da5b1da55599cbadf89aa467255e277c4d6874d22a403",
        "length": 6727
      },
      {
        "path": "skills/investigate-datadog-logs/agents/openai.yaml",
        "sha256": "f51beb2555271da838f7f1d4a8ffbfe5295198d1c46f63211641a1112c2451d1",
        "length": 334
      },
      {
        "path": "skills/manage-notion-ai-memory/SKILL.md",
        "sha256": "f9423474bf97122b1e6b4db7d0005c9ee828da17b8a775faf42634090f1df7b1",
        "length": 6678
      },
      {
        "path": "skills/manage-notion-ai-memory/agents/openai.yaml",
        "sha256": "79def5f0dd6b0e9a6f47f0bb692e3a3bad25c5c62db57e59514bae7a2ed358e2",
        "length": 497
      },
      {
        "path": "skills/manage-notion-ai-memory/references/index-workflow.md",
        "sha256": "ba4a8c72ce26c4fea5de85ca462ddeb4c2353ddcff0ec14c91a89160307ed4cd",
        "length": 10988
      },
      {
        "path": "skills/manage-notion-ai-memory/references/memory-operations.md",
        "sha256": "d13ac162b91c74993ed2b3fde08600bce4ff8d681af3575a38e4810a93d7b8e7",
        "length": 6975
      },
      {
        "path": "skills/manage-notion-ai-memory/references/notion-memory-contract.json",
        "sha256": "c389dbd0240703f9c51cee7b5fe4a86cc9d664efc90453a907f55432ced98ba8",
        "length": 5312
      },
      {
        "path": "skills/manage-task-handoff/SKILL.md",
        "sha256": "d8591da4be19b3fc50f56fa924c7a8057cbf76d528d0407bd6f7ae8a2adafb64",
        "length": 10721
      },
      {
        "path": "skills/manage-task-handoff/agents/openai.yaml",
        "sha256": "e686f4be41c53c21ab2a6456651394e0e7e1af8bfa0f34525938797040ee11ba",
        "length": 377
      },
      {
        "path": "skills/manage-task-handoff/references/git-ref-storage-adapter.md",
        "sha256": "090ce5d494cb3538eb93e4111ea889c96b8bac387e733e570a9a3263af89fb85",
        "length": 976
      },
      {
        "path": "skills/manage-task-handoff/references/handoff-operations.md",
        "sha256": "6681b05eb0fd520094ad1f5755bb15fca0eef5816e0de3fb550bb1c3390b7bc2",
        "length": 6927
      },
      {
        "path": "skills/manage-task-handoff/references/legacy-notion-handoff-contract.json",
        "sha256": "63c33f55724ad3aaaced8c515cbc5c230cb1f71549339bf16bbecf901bd2b5f7",
        "length": 4893
      },
      {
        "path": "skills/manage-task-handoff/references/legacy-notion-handoff-operations.md",
        "sha256": "58ab8439350a0fefb63180195c7afc53fb78a0181a6f2a84ce7d9eb4e5e78d74",
        "length": 3404
      },
      {
        "path": "skills/manage-task-handoff/references/notion-adapter.md",
        "sha256": "7af259b9b65b41719e15097a78763ab46b44211ead6e3cd75dc7652bb55fb2ad",
        "length": 1871
      },
      {
        "path": "skills/manage-task-handoff/references/storage-adapter-contract.md",
        "sha256": "6f6c456fd81d53dbb3def89c41ae6c60fdf70a45bc02640cb49f36f970fcf49d",
        "length": 7548
      },
      {
        "path": "skills/manage-task-handoff/references/task-handoff-contract.json",
        "sha256": "817a7cab8d01a8509cabd53d04224eea951bd853be97cb3114a5ed7a27985c94",
        "length": 19686
      },
      {
        "path": "skills/manage-task-handoff/scripts/HandoffRecordCore.psm1",
        "sha256": "7d7ab7a5ed3330a7d41e9f1e73df0426b4c96972a39f25b7c865fafbecaefc33",
        "length": 66439
      },
      {
        "path": "skills/manage-task-handoff/scripts/LegacyNotionHandoffReplay.psm1",
        "sha256": "cfbe38deeb459afb0ee316c193358be54d9d90521029ac61fa4592576975480e",
        "length": 11040
      },
      {
        "path": "skills/operate-environment-authorized-sql/SKILL.md",
        "sha256": "3513512556a4c439491a91c529e9319452a32fd8b9860b017bdcdca840e00bd6",
        "length": 5633
      },
      {
        "path": "skills/operate-environment-authorized-sql/agents/openai.yaml",
        "sha256": "86c3286173bca580bdf0c8d9e91c6bcc74a09d1895595beeb60b73ba80e2ecef",
        "length": 275
      },
      {
        "path": "skills/operate-environment-authorized-sql/references/acceptance.md",
        "sha256": "a252981f8acf6d54820a0be3d8df49b2b35be794a251aab13f49c4412eb4c30f",
        "length": 2850
      },
      {
        "path": "skills/operate-environment-authorized-sql/references/authorization.schema.json",
        "sha256": "648520ac111a2020e1b4bb4fc7ce4103f1823b63d34bdefcac95dce77a1d9b23",
        "length": 15606
      },
      {
        "path": "skills/operate-environment-authorized-sql/references/installation.md",
        "sha256": "66e717ade34f6b8206164fd06cd1ac1a7635e0048ae2a5d1bae133318646f9c6",
        "length": 3574
      },
      {
        "path": "skills/operate-environment-authorized-sql/references/request.schema.json",
        "sha256": "034b1def988ea55e9806084a98502c926b1fbdfa9c0eb19b269e510680bccec9",
        "length": 11705
      },
      {
        "path": "skills/operate-environment-authorized-sql/references/response.schema.json",
        "sha256": "f3c6c36f7f025fb98e73de7c71d23f5cfe742f6d9c3a3bae94b6d5ea50ccc549",
        "length": 5335
      },
      {
        "path": "skills/operate-environment-authorized-sql/references/runtime-acceptance-cases.json",
        "sha256": "45cedfea316d7297fafebd1534afbffae637609b8131a6d168ad9483bea57eb3",
        "length": 5975
      },
      {
        "path": "skills/operate-environment-authorized-sql/references/sql-policy.md",
        "sha256": "3030314e1bd464044db8d503c1fa96415a4bb304bc6f04dba0ab003ec680259c",
        "length": 3260
      },
      {
        "path": "skills/operate-environment-authorized-sql/references/workflow.md",
        "sha256": "80007f8fe845c8dbf8c6d90fe796968d5f9563669c2ddfdd612b48f23380d6eb",
        "length": 5905
      },
      {
        "path": "skills/operate-environment-authorized-sql/scripts/Test-Contract.ps1",
        "sha256": "bb29cf10141c096d499c7dc34b782309139cd05c39d57a3a7eb5054e9d8b617e",
        "length": 6600
      },
      {
        "path": "skills/plan-production-change/SKILL.md",
        "sha256": "361e510d092ee3fe22a045494cb001716e0c7dc525a68cc6dcca3099d4295599",
        "length": 3953
      },
      {
        "path": "skills/plan-production-change/agents/openai.yaml",
        "sha256": "77d1102e7d89e53dec927c6a09f861ce10585b462ae953a10edc67fa98003f28",
        "length": 305
      },
      {
        "path": "skills/review-agent-skills/SKILL.md",